entry_id,title,artist,album,playlist_name,playlist_description,audio_key,duration
4froIkYsHQMGN8SGPPLlD2,sketches,Seb Wildblood,sketches of transition,On the beach,"A salt-crusted, provocative escape, fusing vintage yacht-rock, Afro-Libyan disco, and kitsch-cool exotica. It drifts from the languid, golden-hour grit of Neil Young to the sultry, carnal pulse of modern Poolside.
",catalog.app/sketches.flac,4:03
1PAum9kEYinePiM7dXgrfo,SK-1,The Vernon Spring,A Plane Over Woods,Ambient Odyssey,"A soundscape of timeless and contemporary ambient and new-age music, designed to calm the mind and lift the spirit.",catalog.app/SK-1.flac,2:02
7z01xZnOx2vx9c8DUXm0oX,An Angel I Know,The Vernon Spring,A Plane Over Woods,Morning Glory,"This relaxed, uplifting compilation weaves soulful sounds into a vibrant tapestry, creating a peaceful yet energizing atmosphere.",catalog.app/An Angel I Know.mp3,2:04
4RLqe2bovXGaVMmG3jHdlU,Mother's Love,The Vernon Spring,A Plane Over Woods,Melting,"A provocative, sun-bleached odyssey, where psych-cumbia, shamanic folktronica, and dusty spaghetti-western noir collide.",catalog.app/Mother's Love.flac,3:41
4K8ghladjXRxWdGg27Vebk,Sitting on a Log,MEZERG,Extended Play,Ambient Odyssey,"A soundscape of timeless and contemporary ambient and new-age music, designed to calm the mind and lift the spirit.",catalog.app/Sitting on a Log.flac,1:50
5gNGSNL3QJXUvtLBGV2F2p,Sing About It,The Wood Brothers,The Muse,Fleeting Moments,"The world around us is a mirror reflecting our inner state. The power to change the world we see lies within us, in how we choose to perceive and engage with the life unfolding before us. ",catalog.app/Sing About It.flac,3:41
4P7yFbakO9tisv6KnGlkOX,Simplicity Mind Tool,Ami Dang,Meditations Mixtape Vol.1,Deep Echoes,"This blend of ancient sounds and soulful melodies is ideal for meditation, yoga, tantra, or any practice seeking tranquility. ",catalog.app/Simplicity Mind Tool.flac,4:39
5C4OSvixDk2Kj3kxNQe8Im,Raiments,Ami Dang,Parted Plains,Cosmic Compass,"This selection sits in a spiritual / cosmic ambient space, blending new age synthesis, early electronic minimalism, sacred jazz, and mystical soundscapes.",catalog.app/Raiments.flac,3:23
6TxCCFtXwayUqR8KpBU6rq,Show Me Everything,Tindersticks,The Something Rain,Soul Flow,"A laid-back sonic journey capturing the austere beauty of nature, where guitar weaves jazz, soul, trip-hop, and folk influences.",catalog.app/Show Me Everything.flac,5:29
6btFCEywMZVZEWxlTYMZ4R,Show Me (Dummy Splash Remix),"Arula,eje (SF),Dummy Splash",Show Me Remixes,Timeless,"A refined blend of ambient jazz and modern classical minimalism, layered with atmospheric textures, spacious, elegant, and quietly emotional.",catalog.app/Show Me (Dummy Splash Remix).mp3,6:32
3u9y3sc7iOPXrADKZ4AYjV,Shavasana,Kamari & Manvir,Shakti's Grace,Altered States,"This curated compilation blends shamanic themes with energetic elements, designed to heighten and expand altered states for both therapeutic and recreational sessions.",catalog.app/Shavasana.flac,11:26
3z8PJ4XUptbHeONPOpsFJq,Corals Under the Sun,"Yehezkel Raz,Sivan Talmor",Vol. 1 - Underwater Fantasies,Subtle Body,"Ethereal tones and primal rhythms blend to awaken the senses, inviting introspection and connection to the unseen.",catalog.app/Corals Under the Sun.flac,2:07
3jFTtSJ3SwPxMXzY9qcN2G,Shallow Water,"Yehezkel Raz,Sivan Talmor",Vol. 1 - Underwater Fantasies,Eclectic Zen,"Each note takes us closer to the eternal, each harmony a bridge to the unseen. In music's embrace, we transcend the ordinary, touching the infinite with every beat.",catalog.app/Shallow Water.flac,1:38
73ZDHja9oGEiFKsjK2IwSl,Sex (Panoramic Sex Heal),The Orb,"COW / Chill Out, World!",Inner Roads,"A journey through magical realism, where the extraordinary meets the everyday and belief shapes reality.",catalog.app/Sex (Panoramic Sex Heal).flac,1:39
7t25849eGqu2zwNIwCzNOa,Ses Canteres,Dario Lessing,DNA,Transition,"By embracing the feelings that align with our deepest truths, we unlock the power to manifest what we believe is possible. ",catalog.app/Ses Canteres.mp3,3:51
2vjWO8NpJw7PHsGHZcDibv,Saraswati Ma,"Benjy Wertheimer,John De Kadt",One River,Altered States,"This curated compilation blends shamanic themes with energetic elements, designed to heighten and expand altered states for both therapeutic and recreational sessions.",catalog.app/Saraswati Ma.flac,8:45
3Ml1KIhji5uKij1TnBitvq,Lila,"Benjy Wertheimer,John De Kadt",One River,Sonic Prayer,"Sacred chants, Indian ragas, and shamanic trance merge in a traditional-modern mix designed to soothe the soul.",catalog.app/Lila.flac,8:03
2bgoRs7l0u1tKCFtZ1lREg,One River,"Benjy Wertheimer,John De Kadt",One River,Deep Echoes,"This blend of ancient sounds and soulful melodies is ideal for meditation, yoga, tantra, or any practice seeking tranquility. ",catalog.app/One River.flac,7:04
1YHT8jzUOom0xHLQHCoJ5g,Sarah,Woo,Into the Heart of Love,Organic Rhythms,"This melodious soundscape showcases guitar in various forms, tabla, and drums, creating a driving, revitalizing, sensual, and expansive experience.",catalog.app/Sarah.mp3,2:19
7FtkqehXOBr1zQ9fGCKJQ6,Sandy Foam,xerLK,Sandy Foam,Oceanic Feeling,"A gentle drift through dreamy downtempo, ambient jazz, and warm instrumental electronica, melodic, airy, and quietly uplifting.",catalog.app/Sandy Foam.flac,2:25
3VmgebuqKphtbuCAYo5sAs,Sakura III,Elijah Nang,Gaijin,Samanke,"This playlist is a sun-drenched blend of global soul and cinematic chill, shifting from earthy tribal rhythms to lush, orchestral-electronic horizons.
",catalog.app/Sakura III.flac,4:37
1q90u7ZAF9XUontn93huAl,Rumble,Link Wray,Link Wray,Soul Flow,"A laid-back sonic journey capturing the austere beauty of nature, where guitar weaves jazz, soul, trip-hop, and folk influences.",catalog.app/Rumble.flac,2:25
46uslKoY3ffmcVWkihYepK,Road Of The Lonely Ones,Madlib,Sound Ancestors,Fleeting Moments,"The world around us is a mirror reflecting our inner state. The power to change the world we see lies within us, in how we choose to perceive and engage with the life unfolding before us. ",catalog.app/Road Of The Lonely Ones.flac,3:38
3Mrn8BzOgZ54KEOXOTl4jW,Riversong,Tonto's Expanding Head Band,Zero Time,Cosmic Compass,"This selection sits in a spiritual / cosmic ambient space, blending new age synthesis, early electronic minimalism, sacred jazz, and mystical soundscapes.",catalog.app/Riversong.flac,7:57
1bokCVvc9srmjMlgj3M4jO,Dream Prayer - Live,Chantress Seba,Light Healing (Live Sessions),Altered States,"This curated compilation blends shamanic themes with energetic elements, designed to heighten and expand altered states for both therapeutic and recreational sessions.",catalog.app/Dream Prayer - Live.flac,4:39
6hhFgKolTIo0PTVxvDzxOm,Rising Into Light - Live,Chantress Seba,Light Healing (Live Sessions),Altered States,"This curated compilation blends shamanic themes with energetic elements, designed to heighten and expand altered states for both therapeutic and recreational sessions.",catalog.app/Rising Into Light - Live.flac,4:37
V6N7tSEujFmu80s8w1rDs,Ra Heset - Live,Chantress Seba,Light Healing (Live Sessions),Genesis,"Creation is the profound act of bringing life into being, giving birth to ideas, turning dreams into reality. Music serves as both spark and guide on this journey of expression.",catalog.app/Ra Heset - Live.flac,4:01
3qf4SpCycYVyf3cfoaFh8W,Rio Grande,Ikebe Shakedown,Stone by Stone,Fleeting Moments,"The world around us is a mirror reflecting our inner state. The power to change the world we see lies within us, in how we choose to perceive and engage with the life unfolding before us. ",catalog.app/Rio Grande.flac,3:50
3H8A2R2TlCejQay5HdQFCv,In Via,Vril,Anima Mundi,Unwind,"This cinematic and expansive blend fuses saxophone, experimental piano, and orchestral strings to evoke inspiration and the splendor of nature.",catalog.app/In Via.mp3,6:22
6DxYb9NYtSWOusao1EQHTy,Riese - Rework,Vril,Anima Mundi,Unwind,"This cinematic and expansive blend fuses saxophone, experimental piano, and orchestral strings to evoke inspiration and the splendor of nature.",catalog.app/Riese - Rework.mp3,4:41
1L4qcdUTurDLqDOaId3H3T,Haus - Rework,Vril,Delsin Records - Best of 2018,Electric Horizon,"Electronic music unlocks new dimensions of awareness, soundtracking this generation’s dance to freedom.",catalog.app/Haus - Rework.flac,6:44
4M4tyrMh157LIUtwUCBsTQ,Return to Source - David Satori Remix,"Poranguí,Liquid Bloom,David Satori",Kuya Sessions: Samadhi Remixes,Altered States,"This curated compilation blends shamanic themes with energetic elements, designed to heighten and expand altered states for both therapeutic and recreational sessions.",catalog.app/Return to Source - David Satori Remix.flac,4:10
2BgXSwlaPmnvKN9jb2y2ze,Rest of My Life,"Guts,Lorine Chia,Tanya Morgan",Eternal,Fleeting Moments,"The world around us is a mirror reflecting our inner state. The power to change the world we see lies within us, in how we choose to perceive and engage with the life unfolding before us. ",catalog.app/Rest of My Life.flac,4:15
5FjCYqJ1S4gcLc7Ik1sc34,Renaissance,HTRK,Death is a Dream,Altered States,"This curated compilation blends shamanic themes with energetic elements, designed to heighten and expand altered states for both therapeutic and recreational sessions.",catalog.app/Renaissance.flac,2:01
2Iarub4S8KlTVa4k8WBiVN,REMAIN - Olga Wojciechowska Rework,"Nathan Fake,Olga Wojciechowska",Providence Reworks: Part II,Ambient Odyssey,"A soundscape of timeless and contemporary ambient and new-age music, designed to calm the mind and lift the spirit.",catalog.app/REMAIN - Olga Wojciechowska Rework.flac,4:43
2MFkpVJ5B2zWgemITtKPzT,Reboot Jam,Krusseldorf,Fractal World,Inhale,"This selection leans into deep, meditative ambient with mystical and minimal electronic textures, occasionally touching psychedelic and ritualistic atmospheres.",catalog.app/Reboot Jam.flac,6:02
10uK6VSbbuiciuFbsTxQaY,Rain Across the Gemini,Krusseldorf,Fractal World,Erotic Nature,"Contemporary ambient, experimental electronic, and psychedelic rock merge in this compilation, forming a soundscape that stimulates the senses.",catalog.app/Rain Across the Gemini.flac,4:34
45mwbchTgcFYfY66P8IHE8,Shutdown,Krusseldorf,Fractal World,Erotic Nature,"Contemporary ambient, experimental electronic, and psychedelic rock merge in this compilation, forming a soundscape that stimulates the senses.",catalog.app/Shutdown.flac,4:10
6468IpX0L3SEaGHktt1t8o,Spirit Ale,Krusseldorf,Fractal World,Erotic Nature,"Contemporary ambient, experimental electronic, and psychedelic rock merge in this compilation, forming a soundscape that stimulates the senses.",catalog.app/Spirit Ale.flac,5:25
6lAesder9vu6pwRr2j2xiR,Circuit Boarding,Krusseldorf,Fractal World,Deep Chill,This compilation of psychill and emotive melodies opens a realm where the boundaries of familiarity dissolve into uncharted sonic landscapes. ,catalog.app/Circuit Boarding.flac,6:36
3GCKDIAJOaQGqh056reCtl,Rainy Nights,Azaleh,Rainy Nights,Mystic Love,"This selection blends spiritual downtempo, psychedelic soul, ambient jazz, and cosmic textures, balancing groove and transcendence.",catalog.app/Rainy Nights.flac,3:46
6Qt8DXUIUYHFIJGAcUs4jH,Rainbow Voice,"David Hykes,The Harmonic Choir",Hearing Solar Winds,Sonic Depths,Dive into an electronic journey where enchanting sounds merge with evocative ambiance and captivating synthesizers. ,catalog.app/Rainbow Voice.mp3,7:09
7oZ7THJKrZXzybIvrk4gnr,Rainbow Rituals,Constant Shapes,Rainbow Rituals,Experimental ,"An experimental ambient soundbath, blending doom, metal, and electronic aesthetics with minimal, classical, and progressive tones. ",catalog.app/Rainbow Rituals.mp3,8:09
7uNwQB82jEgMLR4UtWCPQs,Rack railway To,Roberto Musci,Tower Of Silence,Cosmic Compass,"This selection sits in a spiritual / cosmic ambient space, blending new age synthesis, early electronic minimalism, sacred jazz, and mystical soundscapes.",catalog.app/Rack railway To.flac,3:47
2MMTwSHWxonHSL9sxjGsu5,Quicksand,"Joe Yorke,Stand High Patrol",Quicksand,Soul Flow,"A laid-back sonic journey capturing the austere beauty of nature, where guitar weaves jazz, soul, trip-hop, and folk influences.",catalog.app/Quicksand.flac,4:00
2SCU2eI5cPvfDvpx4ULkdk,Pura Vida,Guts,Guts (Le Bienheureux),Sunrays,"Never forget that you are a living miracle of chance, brimming with echoes of the impossible.",catalog.app/Pura Vida.mp3,3:33
4PeHVSOqNR7tN6bPcUlpq4,Processions,"Paul Horn,Keola Beamer,Christopher Hedge",Himalayan Sessions,Morning Glory,"This relaxed, uplifting compilation weaves soulful sounds into a vibrant tapestry, creating a peaceful yet energizing atmosphere.",catalog.app/Processions.flac,9:37
5WfdSpAENwSq68umWF9n9F,Prayers i,Teebs,Anicca,Unwind,"This cinematic and expansive blend fuses saxophone, experimental piano, and orchestral strings to evoke inspiration and the splendor of nature.",catalog.app/Prayers i.mp3,1:57
4QDUcaSIdp9HS46L1Jj3fB,Post Houmous,Morcheeba,Who Can You Trust? / Beats & B-Sides,Soul Flow,"A laid-back sonic journey capturing the austere beauty of nature, where guitar weaves jazz, soul, trip-hop, and folk influences.",catalog.app/Post Houmous.flac,1:47
1yQaePj0PxULCyfzev4Oqo,Phasma Gigas,Molero,Ficciones Del Trópico,Organic Rhythms,"This melodious soundscape showcases guitar in various forms, tabla, and drums, creating a driving, revitalizing, sensual, and expansive experience.",catalog.app/Phasma Gigas.mp3,4:29
1JSJwMN5dj4hNbYUm8UaBK,Past,Sub Sub,Full Fathom Five,Inner Roads,"A journey through magical realism, where the extraordinary meets the everyday and belief shapes reality.",catalog.app/Past.mp3,2:55
zz8ZI4C4Gguk6wi5UB9kv,Only You (feat. Tame Impala),"Theophilus London,Tame Impala",Only You (feat. Tame Impala),Fleeting Moments,"The world around us is a mirror reflecting our inner state. The power to change the world we see lies within us, in how we choose to perceive and engage with the life unfolding before us. ",catalog.app/Only You (feat. Tame Impala).flac,3:35
2mHlCjKyxLNQA8IHGR8cBM,Onda,Dirk Maassen,Zenith,Instrumental Muse,"A serene selection of classical masterpieces, weaving soft, feminine melodies that draw you inward and gently elevate the moment.",catalog.app/Onda.mp3,3:56
73xYeSygXcePYBVBlLsmq2,Old Graffiti,Bibio,Ribbons,Soul Flow,"A laid-back sonic journey capturing the austere beauty of nature, where guitar weaves jazz, soul, trip-hop, and folk influences.",catalog.app/Old Graffiti.flac,3:28
4XWfLkuZIMD6SSM2VsddXA,Oceans Apart,Ben Crosland,The Turn,Instrumental Muse,"A serene selection of classical masterpieces, weaving soft, feminine melodies that draw you inward and gently elevate the moment.",catalog.app/Oceans Apart.mp3,1:18
4jopLq00maTvbaWvcqsDlX,NW2E,Nuke Watch,Countdown,Cosmic Compass,"This selection sits in a spiritual / cosmic ambient space, blending new age synthesis, early electronic minimalism, sacred jazz, and mystical soundscapes.",catalog.app/NW2E.flac,2:16
Hqf6bD8nJN21e9mM4TBKD,November,"Joseph Shabason,Gigi Masin",Anne,Slow Splendor,"This delicate compilation blends atmospheric jazz and ethereal electronica, drifting gracefully between the everyday and the sublime.",catalog.app/November.mp3,5:09
yEkFFXNn80MVcemg9yN7G,Nostalgia,Matteo Myderwyk,A brief nostalgia,Erotic Nature,"Contemporary ambient, experimental electronic, and psychedelic rock merge in this compilation, forming a soundscape that stimulates the senses.",catalog.app/Nostalgia.flac,3:21
23Q32MC3vlAmViDBTGzduf,North Cormorant Obscurity,Rykard,Arrive The Radio Beacon,Inner Roads,"A journey through magical realism, where the extraordinary meets the everyday and belief shapes reality.",catalog.app/North Cormorant Obscurity.flac,3:17
2duq9Y1xX7XPqbYUgSUkW1,Nomad,"Bedouin Burger,Zeid Hamdan,Lynn Adib",Ma Li Beit,Mystic Love,"This selection blends spiritual downtempo, psychedelic soul, ambient jazz, and cosmic textures, balancing groove and transcendence.",catalog.app/Nomad.flac,3:57
5tP3cewvJepIs3q7iBM95l,"Nocturne No. 8 in D-Flat Major, Op. 27 No. 2","Frédéric Chopin,Park Eun Shik",The Nocturnes,Morning Alchemy,"Begin your day with a smooth and expansive serenade featuring a blend of ambient, blues, gospel, and experimental sounds. ","catalog.app/Nocturne No. 8 in D-Flat Major, Op. 27 No. 2.mp3",6:34
DeylDcwcI7nIGzhkWS0BG,No Words Left,"Hanakiv,Alabaster DePlume",Goodbyes,Slow Splendor,"This delicate compilation blends atmospheric jazz and ethereal electronica, drifting gracefully between the everyday and the sublime.",catalog.app/No Words Left.mp3,7:18
2WEC86NDWWCQQGWpj5Gyp3,Nisyan,Ahmed Fakroun,Compilation,On the beach,"A salt-crusted, provocative escape, fusing vintage yacht-rock, Afro-Libyan disco, and kitsch-cool exotica. It drifts from the languid, golden-hour grit of Neil Young to the sultry, carnal pulse of modern Poolside.
",catalog.app/Nisyan.flac,4:16
5wuXCoIwOWoqcjJej393M9,Nightvision,Daft Punk,Discovery,Inner Roads,"A journey through magical realism, where the extraordinary meets the everyday and belief shapes reality.",catalog.app/Nightvision.flac,1:44
5JGj3PsZsLpFqco1wTUqVM,Nightcrawler,Nosaj Thing,Nightcrawler,Unwind,"This cinematic and expansive blend fuses saxophone, experimental piano, and orchestral strings to evoke inspiration and the splendor of nature.",catalog.app/Nightcrawler.mp3,3:45
26scYu42KpuZnueNzKmq0K,Night,"Ludovico Einaudi,Amsterdam Sinfonietta",Elements (Deluxe Edition),Celestial Romance,"In a vast universe of infinite possibilities, finding a heart that aligns with ours feels miraculous, a cosmic soundscape evoking the boundless expanse of space and time.",catalog.app/Night.mp3,5:30
36mdP5bVEJ9mjUoVAHvD7T,Nectar Drop,DJ Drez,Jahta Beat: The Lotus Memoirs,Morning Glory,"This relaxed, uplifting compilation weaves soulful sounds into a vibrant tapestry, creating a peaceful yet energizing atmosphere.",catalog.app/Nectar Drop.mp3,4:00
4cqHHhFh1oHAmm2ZMI6lMz,Natural Interlude #1,Natural Interlude,Americana Series: Mountain Aire,Ethereal Nature,"This meditative compilation blends nature sounds with ambient, dreamy soundscapes and a hint of Eastern influences.",catalog.app/Natural Interlude #1.mp3,1:05
7aMhasLEcxGgeIa5KgRM76,Native Flute 192 Hz,Relaxation Meditation Songs Divine,"Binaural Hz Tones (Solfeggio Frequencies Healing Meditation, Relaxation, Stress Reduction, Repair DNA, Binaural Beats for Anxiety, Depression, Migraine)",Binaural Waves,"Experience immersive binaural beats that deepen meditation, improve sleep, boost focus, and spark creativity, guiding you into deep relaxation and inspiration.",catalog.app/Native Flute 192 Hz.mp3,4:06
YNLjPaOMrUY9TXSixvgB0,Midnight Blue,Sainkho Namtchylak,Naked Spirit,Silent Dream,"This journey blends shamanic rhythms, mystical vibes, and primal sounds to create a deep, meditative atmosphere for relaxation and inner exploration.",catalog.app/Midnight Blue.mp3,2:04
5YVC5rceXXKjf0jp5IbDtH,Naked Spirit (featuring Djivan Gasparyan),Sainkho Namtchylak,Naked Spirit,Tantric Flow,"A ritualistic blend of meditation, chants, and rare instruments from around the world, creating a sound that transcends genres.",catalog.app/Naked Spirit (featuring Djivan Gasparyan).mp3,4:41
5zaDxPqEyZwERJIHWeJM3x,From me to you,Sainkho Namtchylak,Sacred Planet (From women & man to gods & godnesses),Unwind,"This cinematic and expansive blend fuses saxophone, experimental piano, and orchestral strings to evoke inspiration and the splendor of nature.",catalog.app/From me to you.mp3,3:49
6IwKZKYDefgudE9WZok6yE,My Things,Alpha,Come From Heaven,Inner Roads,"A journey through magical realism, where the extraordinary meets the everyday and belief shapes reality.",catalog.app/My Things.flac,4:09
2WQ8TIvYri6zn8GAqnKEKA,Music for Tundra Pt. 1,Tim Hecker,Haunt Me,Experimental ,"An experimental ambient soundbath, blending doom, metal, and electronic aesthetics with minimal, classical, and progressive tones. ",catalog.app/Music for Tundra Pt. 1.mp3,5:12
1qqaG8BDk2SKpySD9x28Wm,Mountain Eagle - The Black Frame Desert Mix,"Rebolledo,The Novotones,The Black Frame",Mountain Eagle (The Black Frame Desert Mix),Morning Alchemy,"Begin your day with a smooth and expansive serenade featuring a blend of ambient, blues, gospel, and experimental sounds. ",catalog.app/Mountain Eagle - The Black Frame Desert Mix.flac,6:33
7vrjIhJUcv8ZCbF0sLyk35,Mother Whale,"Ekoa,Pata Negra",Mother Whale,Oceanic Feeling,"A gentle drift through dreamy downtempo, ambient jazz, and warm instrumental electronica, melodic, airy, and quietly uplifting.",catalog.app/Mother Whale.flac,5:22
7o9CnzhZW5eAKtUgQgq0zx,Morning Mood,mar-feliz,Morning Mood,Morning Mood,This lighthearted and eclectic compilation invites listeners to embark on a joyful journey across a vibrant ocean of sound.,catalog.app/Morning Mood.flac,1:48
RH8krvAZXJiQeGSViVkLA,Let It Slide,Desmond Cheese,Peace & Quiet,Soft Mornings,"This playlist is a velvety blend of dreamy jazz, ambient textures, and nostalgic soul, creating a moonlit sanctuary for deep connection.",catalog.app/Let It Slide.flac,3:42
2Sw3LV3GIpTyo7ajEVNuPu,Pimp Floyd,Desmond Cheese,Peace & Quiet,On the beach,"A salt-crusted, provocative escape, fusing vintage yacht-rock, Afro-Libyan disco, and kitsch-cool exotica. It drifts from the languid, golden-hour grit of Neil Young to the sultry, carnal pulse of modern Poolside.
",catalog.app/Pimp Floyd.flac,2:50
4lC2VSRwxt0YcFzoTa9v9g,Morning Glory,Desmond Cheese,Sunrise and Set,Morning Glory,"This relaxed, uplifting compilation weaves soulful sounds into a vibrant tapestry, creating a peaceful yet energizing atmosphere.",catalog.app/Morning Glory.flac,1:45
6wnJAEBeCIX5nd3lbtcc1j,Moonlight Sonata,Ludwig van Beethoven,Moonlight Sonata - Single,Timeless,"A refined blend of ambient jazz and modern classical minimalism, layered with atmospheric textures, spacious, elegant, and quietly emotional.",catalog.app/Moonlight Sonata.mp3,7:27
3eesOz8JolWg6yGd94HxKR,Moon Magic (Chandra) (Part 1 - Alap),Stevin McNamara,Shanti Guitar,Serendipity,"This spacious, melodic ambient selection is ideal as background music for serene moments and gentle, mindful activities.",catalog.app/Moon Magic (Chandra) (Part 1 - Alap).flac,5:08
1XDON2DfDXD94gcef5mXfz,Awake,Tycho,Awake,Sunrays,"Never forget that you are a living miracle of chance, brimming with echoes of the impossible.",catalog.app/Awake.mp3,4:43
slOrkMEBQ4Sg9HUXRAX6p,Montana,Tycho,Awake,Soul Flow,"A laid-back sonic journey capturing the austere beauty of nature, where guitar weaves jazz, soul, trip-hop, and folk influences.",catalog.app/Montana.flac,5:26
kHH80LakAxecO24rUj1Mm,Monagah (Prayer),Mohammed Naiem,Hossam Ramzy Presents: Master of the Arabian Flute,Silent Dream,"This journey blends shamanic rhythms, mystical vibes, and primal sounds to create a deep, meditative atmosphere for relaxation and inner exploration.",catalog.app/Monagah (Prayer).mp3,5:31
1rhk6oTu4RbugSenpjlChn,Molfsee - 2019 remaster,Ulrich Schnauss,Far Away Trains Passing By,Inner Roads,"A journey through magical realism, where the extraordinary meets the everyday and belief shapes reality.",catalog.app/Molfsee - 2019 remaster.flac,8:10
2Os48ZIFVvp1xT2hg8ttN2,Minamata Piano Theme,Ryuichi Sakamoto,Minamata (Original Motion Picture Soundtrack),Slow Splendor,"This delicate compilation blends atmospheric jazz and ethereal electronica, drifting gracefully between the everyday and the sublime.",catalog.app/Minamata Piano Theme.mp3,2:50
9tr38nE2CdXw9vqUNzhHl,Miloli'i Slack Key,Ken Emerson,Slack Key Guitar,Fleeting Moments,"The world around us is a mirror reflecting our inner state. The power to change the world we see lies within us, in how we choose to perceive and engage with the life unfolding before us. ",catalog.app/Miloli'i Slack Key.flac,3:27
4UcAAoWPzJ0upv4ocriXdX,Midnight Laughter,"MONKYMAN,Pshiuu",Fable,Deep Distance,"Tune in and drift between worlds, where thoughts and intentions shape reality like a lucid dream, full of possibility.",catalog.app/Midnight Laughter.mp3,5:27
6loHjdjncHiF8iboclHz2I,Midnight Feast,Mr. Scruff,Keep It Unreal (10th Anniversary Analogue Remaster Edition),Inner Roads,"A journey through magical realism, where the extraordinary meets the everyday and belief shapes reality.",catalog.app/Midnight Feast.flac,3:36
R1iO1T1mkBYYpQivYFbvg,Merhaba,Qadir Bijoux,MEWE.,Fleeting Moments,"The world around us is a mirror reflecting our inner state. The power to change the world we see lies within us, in how we choose to perceive and engage with the life unfolding before us. ",catalog.app/Merhaba.flac,3:03
43BKxaWgEHAWZdSqj8ZdzE,Menagerie,Baraka,Aquarium,Sunrays,"Never forget that you are a living miracle of chance, brimming with echoes of the impossible.",catalog.app/Menagerie.flac,3:51
1KKqus1MEvYN1uFs1RE7Me,Meditation,Turu Anasi,Meditation,Morning Glory,"This relaxed, uplifting compilation weaves soulful sounds into a vibrant tapestry, creating a peaceful yet energizing atmosphere.",catalog.app/Meditation.flac,8:29
1DRfpORXmYbz19Nebuaxa4,Grow - A COLORS ENCORE,FACESOUL,YSRA,Slow burn,"This collection creates an intimate, sacred space where dusty desert folk meets the deep pulse of a shared heartbeat.",catalog.app/Grow - A COLORS ENCORE.flac,3:27
1zor8jGm3WZIqkKOW7OxuD,Medicine,FACESOUL,YSRA,Sunrays,"Never forget that you are a living miracle of chance, brimming with echoes of the impossible.",catalog.app/Medicine.flac,2:08
650p8DlrZM4VQTkFQLkJQ4,Love,FACESOUL,YSRA,Genesis,"Creation is the profound act of bringing life into being, giving birth to ideas, turning dreams into reality. Music serves as both spark and guide on this journey of expression.",catalog.app/Love.flac,2:47
6ozNlr41gp1lx4DqWzokpx,Matches - Maugli Remix,"Rapossa,MAUGLI",Matches Remixes,Mystic Love,"This selection blends spiritual downtempo, psychedelic soul, ambient jazz, and cosmic textures, balancing groove and transcendence.",catalog.app/Matches - Maugli Remix.flac,6:17
